{
  "$schema": "../../input/scene_schema.json",
  "name": "Cans with plane scene",
  "textures": [
    {
      "name": "checker",
      "path": "assets/textures/checker.png"
    }
  ],
  "meshes": [
    {
      "name": "plane",
      "path": "assets/meshes/plane.obj",
      "rotate": true,
      "uniform": false
    },
    {
      "name": "can",
      "path": "assets/meshes/can.obj",
      "rotate": true,
      "uniform": false
    }
  ],
  "materials": [
    {
      "name": "mate_blue",
      "color": {
        "r": 0.12,
        "g": 0.12,
        "b": 1.0
      },
      "shininess": 32.0,
      "specular_strength": 0.5,
      "diffuse_strength": 1.0
    },
    {
      "name": "mate_red",
      "color": {
        "r": 1.0,
        "g": 0.12,
        "b": 0.12
      },
      "shininess": 32.0,
      "specular_strength": 0.5,
      "diffuse_strength": 1.0
    },
    {
      "name": "mate_green",
      "color": {
        "r": 0.12,
        "g": 1.0,
        "b": 0.12
      },
      "shininess": 32.0,
      "specular_strength": 0.5,
      "diffuse_strength": 1.0
    },
    {
      "name": "mate_green_red",
      "color": {
        "r": 0.7,
        "g": 0.7,
        "b": 0.12
      },
      "shininess": 32.0,
      "specular_strength": 0.5,
      "diffuse_strength": 1.0
    },
    {
      "name": "checker",
      "color": {
        "r": 1.0,
        "g": 1.0,
        "b": 1.0
      },
      "shininess": 32.0,
      "specular_strength": 0.5,
      "diffuse_strength": 1.0,
      "albedo_texture_name": "checker"
    }
  ],
  "objects": [
    {
      "position": {
        "x": 0,
        "y": -0.1,
        "z": 0
      },
      "rotation": {
        "x": 0,
        "y": 0,
        "z": 0
      },
      "scale": {
        "x": 1,
        "y": 1,
        "z": 1
      },
      "mesh_name": "can",
      "material_name": "mate_green"
    },
    {
      "position": {
        "x": 0,
        "y": 0.1,
        "z": 0
      },
      "rotation": {
        "x": 0,
        "y": 0,
        "z": 0
      },
      "scale": {
        "x": 1,
        "y": 1,
        "z": 1
      },
      "mesh_name": "can",
      "material_name": "mate_green"
    },
    {
      "position": {
        "x": -0.2,
        "y": 0.1,
        "z": 0
      },
      "rotation": {
        "x": 0,
        "y": 0,
        "z": 0
      },
      "scale": {
        "x": 1,
        "y": 1,
        "z": 1
      },
      "mesh_name": "can",
      "material_name": "mate_red"
    },
    {
      "position": {
        "x": -0.2,
        "y": -0.1,
        "z": 0
      },
      "rotation": {
        "x": 0,
        "y": 0,
        "z": 0
      },
      "scale": {
        "x": 1,
        "y": 1,
        "z": 1
      },
      "mesh_name": "can",
      "material_name": "mate_red"
    },
    {
      "position": {
        "x": -0.4,
        "y": 0.1,
        "z": 0
      },
      "rotation": {
        "x": 0,
        "y": 0,
        "z": 0
      },
      "scale": {
        "x": 1,
        "y": 1,
        "z": 1
      },
      "mesh_name": "can",
      "material_name": "mate_blue"
    },
    {
      "position": {
        "x": -0.4,
        "y": -0.1,
        "z": 0
      },
      "rotation": {
        "x": 0,
        "y": 0,
        "z": 0
      },
      "scale": {
        "x": 1,
        "y": 1,
        "z": 1
      },
      "mesh_name": "can",
      "material_name": "mate_blue"
    },
    {
      "position": {
        "x": -0.6,
        "y": 0.1,
        "z": 0
      },
      "rotation": {
        "x": 0,
        "y": 0,
        "z": 0
      },
      "scale": {
        "x": 1,
        "y": 1,
        "z": 1
      },
      "mesh_name": "can",
      "material_name": "mate_green"
    },
    {
      "position": {
        "x": -0.6,
        "y": -0.1,
        "z": 0
      },
      "rotation": {
        "x": 0,
        "y": 0,
        "z": 0
      },
      "scale": {
        "x": 1,
        "y": 1,
        "z": 1
      },
      "mesh_name": "can",
      "material_name": "mate_green"
    },
    {
      "position": {
        "x": -0.8,
        "y": 0.1,
        "z": 0
      },
      "rotation": {
        "x": 0,
        "y": 0,
        "z": 0
      },
      "scale": {
        "x": 1,
        "y": 1,
        "z": 1
      },
      "mesh_name": "can",
      "material_name": "mate_red"
    },
    {
      "position": {
        "x": -0.8,
        "y": -0.1,
        "z": 0
      },
      "rotation": {
        "x": 0,
        "y": 0,
        "z": 0
      },
      "scale": {
        "x": 1,
        "y": 1,
        "z": 1
      },
      "mesh_name": "can",
      "material_name": "mate_red"
    },
    {
      "position": {
        "x": 0,
        "y": 0,
        "z": 0
      },
      "rotation": {
        "x": 0,
        "y": 0,
        "z": 0
      },
      "scale": {
        "x": 1,
        "y": 1,
        "z": 1
      },
      "mesh_name": "plane",
      "material_name": "checker"
    }
  ],
  "light": {
    "position": {
      "x": 3,
      "y": 0,
      "z": 4.5
    },
    "color": {
      "r": 0.5,
      "g": 0.5,
      "b": 0.5
    }
  },
  "ambient_light": {
    "color": {
      "r": 0.1,
      "g": 0.1,
      "b": 0.1
    }
  },
  "camera": {
    "position": {
      "x": 1.0,
      "y": 0,
      "z": 0.4
    },
    "look_at": {
      "x": 0.0151922703,
      "y": 0,
      "z": 0.226351783
    },
    "sensor_size": 30.0,
    "focal_length": 32.0,
    "f_stop": 1.0,
    "z_far": 1000
  }
}